<?xml version="1.0" encoding="utf-8" ?>
<group xmlns:xsi="http://www.w3.org/2001/XMLSchema-instance"
         xsi:schemaLocation="http://jd02_09a.loktev.it.by group.xsd"
         xmlns="http://jd02_09a.loktev.it.by"
>
    <square left="20" top="30" width="40" height="5" stroke="blue" />
    <square left="20" top="30" width="40" height="5" stroke="blue" />
    <circle centerx="50" centery="50" radius="20" fill="red" />
    <text left="77" top="88">
        HELLO!
    </text>
    <circle centerx="50" centery="50" radius="20" fill="red" />
    <square left="20" top="30" width="40" height="5" stroke="blue" />
    <circle centerx="50" centery="50" radius="20" fill="red" />
</group>